1442	com.android.browser;com.android.calculator2;com.android.browser	Open browser to Ikea dot com. Open a new tab on Ikea dot com. Ikea cabinets. Open calculator app. Cabinet price twenty dollars plus a hundred and fifty dollars. Open browser to Ikea dot com.	open browser to ikea.com (0.98762906) open a new tab on ikea.com (0.98385614) IKEA cabinets (0.98762906) open calculator app (0.96551007) cabinet price $20 + $150 (0.90594959) open browser to ikea.com (0.98762906)
1443	com.android.mms;call;com.android.contacts	Open text messages. Scott. Where are you? Call Scott cell. Open contacts.	Open Text Messages (1) Scott (0.80812836) where are you (0.96162099) call Scott cell (0.98732561) open contacts (0.98762906)
1444	com.android.browser;com.google.android.apps.docs	Op Open Ikea dot com in browser. Search for cabinet manual on Ikea dot com. Download PDF of manual onto docs.	open ikea.com in browser search for cabinet manual on ikea.com (0.97420341) download pdf of manual on 2006 (0.93399751)
1445	call;com.android.mms	Call Scotts Cell. Text Scott. I am finished.	call Scott cell (0.98737603) text Scott (0.95198315) I am finished (0.98762912)
1446	jp.kyocera.camera;com.android.mms	Open camera. Select funny cat picture. Attach to text message for Scott. Look at the cat haha.	open camera (0.98646849) select funny cat picture (0.96635127) attached to text message for Scott (0.96343786) look at the cat haha
1447	com.android.browser;com.google.android.youtube;com.android.browser	Dlisted dot com. Select snowman video link. Open using youtube. Alright Now the video is over close youtube. Return to dlisted on the browser.	dlisted.com (0.98762906) select snowman video link (0.91614723) open using YouTube (0.97870016) I know that the videos over clothes YouTube (0.91013122) return to be listed on the browser (0.90451229)
1448	com.google.android.gm;com.android.browser;com.google.android.gm;com.android.browser	Open gmail. open new message. click on link. open in browser. return to gmail. open other link in browser.	open gmail (0.97872198) open new message (0.87261635) click on link open in browser (0.96911007) return to Gmail (0.95287865) open other link in browser
1449	com.google.android.gm;com.google.android.apps.docs;com.google.android.gm	Open Gmail. View message. Download document. View Document. Return to Gmail.	open gmail (0.9789995) you message (0.82368827) download document (0.98217392) view document (0.94938481) return to Gmail (0.95273226)
1450	com.android.calculator2;jp.kyocera.camera	Open calculator. Three hundred and eighty four point five times eight. Open camera. Take picture of item. Take another picture of item.	open calculator (0.98762906) 384.5 times 8 (0.96614045) open camera (0.98760879) take picture of item (0.98188794) take another picture of item (0.99010324)
1451	jp.kyocera.camera;com.android.mms	Open Camera. Take picture of view from window. Attach to text message for scott. The weather stinks.	open camera (0.98762906) take picture of view from window (0.98088187) attached to text message for Scott (0.95781606) the weather stinks (0.98762912)
1452	com.android.mms;jp.kyocera.camera;com.android.mms	Compose message for Jackie. Attach image from camera Old Building photo. I'd like to say in the message look at this old building.	compose message for Jackie (0.94234407) attach image from camera (0.96141791) old building photo (0.97547245) I'd like to say in the message look at this old building (0.95519)
1453	com.google.android.gm;com.android.browser	Open gmail. Open link for community program.	open gmail (0.97871161) open link for Community Program (0.77422494)
1454	com.android.mms;jp.kyocera.camera;com.android.mms;jp.kyocera.camera;com.android.mms	Compose text message for Scott. Attach image of cat looking silly. Text check this out. Send message. Open reply from Scott. Attach different picture of cat. He is still silly.	compose text message for Scott (0.9908188) attach image of cat looking silly (0.90930015) text check this out (0.98762906) send message (0.98762906) open reply from Scott (0.96677089) attach different picture of cat (0.97651815) he is still silly (0.96864748)
1455	com.google.android.gm;com.android.browser	Open gmail. Click on link for next door website.	open gmail (0.97871161) click on link for next door website (0.93875378)
1456	call	Call my parents at home.	call my parents at home (0.98762906)
1457	jp.kyocera.camera;com.android.mms	Open Camera. Select picture of giant pizza. Attach to new text message for Jackie. Check out this crazy pizza.	open camera (0.98762906) select picture of giant pizza (0.99010324) attached to new text message for Jackie (0.95156306) check out this crazy pizza (0.94042647)
1458	com.android.browser;com.birdstep.android.cm;com.android.browser	Open browser. Open settings to turn on wifi. Return to browser. Google dot com.	open browser (0.98762906) open settings to turn on wifi return to browser (0.97244716) google.com (0.95228302)
1459	com.android.browser;com.birdstep.android.cm;com.android.browser;com.birdstep.android.cm;com.android.browser	Open browser. Turn on wifi with birdstep. Return to browser. Turn wifi on and off using birdstep. Return to browser. Dlisted dot com.	open browser (0.98762906) turn on Wi-Fi with bird stuff return of browser turn Wifi on and off on bird step return to browser dlisted.com (0.98762906)
1460	com.android.browser;com.android.chrome;com.android.browser;com.android.chrome	Open dlisted dot com. Yes. Open Radar dot com using the android browser. Yes open with chrome. Open a new tab in chrome for Mad dot com.	open dlisted.com (0.9483214) yes (0.55181062) open radar.com using Android browser (0.97168815) yes open with chrome (0.97219938) open a new tab in chrome for match.com (0.95996153)
1461	com.android.browser;com.android.chrome	Open Mad dot come on android browser. Open with chrome.	open match.com on Android browser (0.98304766) open with chrome (0.97377473)
1462	com.android.browser;com.android.chrome	Open TMZ dot com using android browser. Open with Chrome.	open tmz.com using Android browser (0.97360802) open with chrome (0.98667502)
1463	com.google.android.gm;com.android.chrome;com.android.browser	Open Gmail. Select link for nextdoor dot com Open Nextdoor dot com link in android browser.	open gmail (0.9789834) select link for nextdoor.com open nextdoor.com link in Android browser
1464	com.android.settings;com.android.browser	Open android settings. Turn off Wifi. Open browser to Ikea dot com.	open Android settings (0.98762912) turn off Wifi open browser to ikea.com (0.98762906)
1465	com.android.mms;jp.kyocera.camera;com.android.mms	Compose picture message to Holly. Attach picture of spots caster. Do you remember this guy? Open Reply.	compose picture message to Holly (0.97248471) attach picture of sportscaster (0.9323765) do you remember this guy (0.9599207) open reply (0.98254299)
1466	call;com.coremobility.apps.vnotes;call;com.coremobility.apps.vnotes;call	I swipe to ignore. Open the voicemail app and check the message. Delete message.	swipe to ignore (0.85377836) open the voicemail app and check the message delete message (0.96441209)
1467	com.android.mms;jp.kyocera.camera;com.android.mms	Ok open text message. Compose message to Scott. Do you have Oh sorry. Attach picture of book. Do you have this book already? " Reply ""I will get it for you""."	Open Text Message (0.92546886) compose message to Scott (0.97763139) do you have a picture of book (0.93101728) do you have this book already (0.97976536) reply I will get it for you (0.96985072)
1468	com.android.settings;com.android.browser	Open Android settings. Turn on Wifi. Open browser to Cracked dot com.	open Android settings (0.98762912) turn on Wifi open browser to cracked.com (0.97402579)
1469	com.google.android.apps.maps;com.android.browser	Open maps and get bus directions to Troy Hill. Open browser to view Troy Hill information.	open maps and get bus directions to Troy Hill (0.95985478) open browser to view Troy Hill information (0.98636645)
1470	com.android.browser;com.android.settings;com.android.browser;com.android.chrome;com.android.browser;com.android.chrome	Open Browser to grumpy cat dot com. Open settings. Turn Wifi on. Open browser to grumpy cat dot com. Open TMZ dot com using chrome. Open TMZ dot com using android browser. Open radar online using chrome.	open browser to grumpy cat.com (0.94605702) open settings (0.98095363) turn Wifi on open browser to grumpy cat.com (0.98185694) open tmz.com using Chrome (0.93999958) open tmz.com using Android browser (0.97320187) open radar on line using from (0.91815668)
1471	jp.kyocera.camera;com.android.mms	Open up camera. Select picture of Band. Compose Attach sorry Attach to text message to Scott. Look at this great picture.	open up camera (0.9659217) select picture of bands (0.96462649) compose a text that's attached to text message for Scott (0.97745693) look at this great picture (0.95893395)
1472	com.android.chrome;com.android.browser;com.android.chrome	Open Dlisted dot com using chrome. Opening Dlisted dot com using android browser. Try to open Dlisted dot com using chrome again.	open dlisted.com using Chrome (0.96746457) open dlisted.com using Android browser (0.97204435) tread open dlisted.com using Chrome again
1473	com.android.settings;com.android.browser;com.android.chrome	Open settings. Turn off Wifi. Open Dlisted dot com using android browser. Open Dlisted dot com using Chrome.	open settings (0.98757815) turn off Wifi open dlisted.com using Android browser (0.97567445) open dlisted.com using Chrome (0.95930016)
1474	jp.kyocera.camera;com.android.mms	Open camera gallery. Select picture of mountain. Compose text message to Jackie. Is this by where you live? Attached attach picture of mountain to message.	open camera gallery (0.98762912) select picture of mountain (0.97036207) compose text message to Jackie (0.98532951) is this by where you live (0.96365196) attached attached picture of mountains to message
1475	com.android.settings;com.android.browser;com.android.chrome	Open settings. Turn off Wifi. Open Ikea dot com using browser. Open new tab on android browser for dlisted dot com. Open dlisted dot com using chrome.	open settings (0.98757476) turn off Wifi open ikea.com using browser (0.97547865) open new tab on Android browser for dlisted.com (0.96631062) open dlisted.com using Chrome (0.93411589)
1476	com.google.android.gm;com.android.browser	open Gmail. Select link for nextdoor dot com and open in browser.	open gmail (0.98004937) select link for nextdoor.com open in browser
1477	com.android.settings;com.android.browser	Open settings. Turn off Wifi. Open Ikea dot com using browser.	open settings (0.98504174) turn off Wifi open ikea.com using browser (0.98189658)
1478	com.android.browser;com.android.chrome	Open grumpycat dot com using browser. Open grumpycat dot com using chrome.	open grumpy cat.com using Android browser (0.97594833) open grumpycat.com using chrome
1479	jp.kyocera.camera;com.android.mms	Open camera gallery. Take picture of cat. Take another picture of cat. Compose text message and attach better picture of cat. Scott. What a funny face.	open camera gallery (0.98762912) take picture of cat (0.99072182) take another picture of cat (0.97489882) compose text message and attach better picture of cat (0.97715163) Scott (0.86931872) what a funny face (0.98259068)
1480	com.facebook.katana;com.htc.calendar	Open facebook. When is Christmas party? Open calendar. Confirm time.	open facebook when is Christmas party (0.9633171) open calendar (0.69836783) confirm time (0.91003978)
1481	com.htc.album;com.android.mms	Open gallery. Send picture one to Sabrina via text.	open gallery (0.98762906) send picture 12 Sabrina via text (0.79343051)
1482	com.android.mms	Open text write what's up. Send.	Open Text right what's up send (0.86942667)
1483	com.facebook.katana;com.android.browser	Open facebook. Open article on Internet Explorer.	open facebook (0.97789061) open article on Internet explorer (0.95248413)
1484	com.htc.android.mail;com.android.browser;com.android.mms	Open email. Open message from Applebee's. Click on schedule. Send text to Emily. I work tomorrow night.	open email (0.94268966) open message from Applebee's (0.93975592) click on schedule (0.95613319) send a text to Emily (0.72625029) I work tomorrow night (0.98043674)
1485	com.pinterest;com.android.mms	Open Pinterest. Look search chicken parmesan recipe. Open first recipe. Send message send text to Emily. Do you want chicken parmesan?	open Pinterest (0.98762906) look search chicken parmesan recipe (0.98727769) open first recipe (0.9548133) send message send text to Emily (0.96887416) do you want chicken parmesan (0.98762906)
1486	call;com.android.mms	Call Leslie. Mobile. Hang up. Send text. Call me back after 10. Going to work.	call Leslie (0.91673338) metal (0.78577429) hangouts send text (0.93527269) call me back after 10 going to work
1487	com.sec.android.app.camera;com.android.mms	Send ok. Open open photo gallery. Send first picture to Jason via text.	open gallery open photo gallery (0.98762906) send first picture to Jason via text (0.96886927)
1488	com.sec.android.app.camera;com.android.mms	Open camera. Take picture. Send picture in text message to Jason.	open camera (0.98106694) take picture (0.98103714) send picture in text message to Jason (0.95468712)
1489	com.android.vending;com.rechild.advancedtaskkiller	Open Google Play and search task killer app. Open app. Kill apps.	open Google Play and search task killer app (0.98602253) open app kill all apps
1490	com.rechild.advancedtaskkiller	Can you open task killer and kill all the background apps?	can you open the task killer and kill all background apps
1491	com.sec.android.app.camera;com.sec.android.gallery3d;com.android.mms	Take a photo and send to Jason in text.	the photo and send to Jason in text (0.95143497)
1492	com.android.chrome;com.google.android.youtube;com.android.mms	Can you google types of tires on mitsubishi and then pull up a video how to change the tire. Ok. Then text mom I don't know how.	can you google types of tires on Mitsubishi and then pull up a video of how to change a tire okay then text mom I don't know how (0.92902136)
1493	com.pnc.ecommerce.mobile;com.android.mms	Check can you check my PNC account balance and see if I got the deposit for a hundred dollars? Ok text mom and tell her yes I got it.	check out can you check my PNC account balance and see if I got the deposit $400 (0.95165604) okay text mom and tell her yes I got it (0.98613417)
1494	call;com.android.mms	Can you call Shannon cell phone? text shannon and tell her I'll be there in ten minutes.	can you call Shannon cell phone (0.969886) text Shannon and tell her I'll be there in 10 minutes (0.97654247)
1495	com.android.mms;com.redbox.android.activity	Text Jason and ask him what movie he wants to get. check the redbox and see what new rentals are available.	text Jason and asked what movie he wants to get um check Redbox and see what new rentals are available (0.91220152)
1496	com.timehop;com.android.mms	Let me see today's timehop pictures. Send the first one to Leslie in a text.	let me see today's time hot pictures (0.94238698) send the first one to Leslie in a text (0.97942567)
1497	com.nowaitapp.consumer;com.android.mms	look on the no look on nowait and see long it is for hofbrauhaus tonight. Text nikki and tell her fifteen minute wait.	look on the notebook on no wait and see how long it is for Hoffer house tonight text Nikki and tell her 15 minute wait
1498	com.pnc.ecommerce.mobile;com.android.mms	Look on my PNC account and see if the transfer was sent for five hundred to mom. Text mom and tell her yes it was sent.	look up my PNC account and see if the transfer was sent for 502 months text mom and tell her yes it was sent (0.91069573)
1499	com.sec.android.app.camera;com.android.mms	Let me see my the pictures I took today. Send picture send the first picture to Jason in text.	let me see my the pictures I took today (0.98570919) send pictures and the first picture to Jason in text
1500	com.android.mms;com.nowaitapp.consumer;com.android.chrome	Text Stacey and ask her what she wants for dinner. Open nowait app and see what the times are for the restaurants nearby. go to CMU cafeteria website and download the dinner menu.	text Stacey and ask her what she wants for dinner open no wait app and see what the times are for restaurants nearby (0.97553211) I go to CMU cafeteria website and download the best dinner menu (0.87569255)
1501	com.android.chrome;com.nowaitapp.consumer;com.android.chrome;call	Go to the website for chart house. And then go on to the menu. Show me the dinner menu. Ok go on to nowait and see what the wait time is for chart house. Ok call chart house. I made a reservation so call salt grass.	go to the website for Chart House (0.96162301) and then go on to the menu on show me dinner menu (0.97234315) girl on the new wait and see what the wait time is for Chart House call Chart House (0.94491416) I made the reservation so called Saltgrass
1502	call;com.google.android.apps.maps	Call Grand Hyatt hotel in San Antonio. Open maps and put in the address five hundred grand street san antonio.	call Grand Hyatt Hotel in San Antonio (0.98740512) open maps and put in the address 500 Grant Street San Antonio (0.98532462)
1503	com.instagram.android;com.sec.android.app.camera;com.android.mms	Open instagram and add the photo I just took. Then send it to Jason in a text message. Look at the view.	open Instagram and add the photo I just took (0.96799767) then send it to Jason in a text message look at the view (0.92918998)
1504	com.sec.android.app.camera;com.android.mms	Umm open camera and take photo. Send via picture message to Emily cell. Wish you were here.	open camera and take photo send it via picture message to Emily cell (0.83610386) wish you were here (0.96427917)
1505	com.sec.android.app.camera;com.android.mms	Open camera and take photo. Send picture message to jason. Look at the sunset.	open camera and take photo (0.98289788) send picture message to Jason (0.97878093) look at the sunset
1506	com.timehop;com.android.mms	Open timehop. Send picture from this day on last year to Ryan cell.	open time hop (0.93067759) send picture from this day on last year to Ryan cell (0.96475542)
1507	com.bodybuilding.mobile;com.sec.android.app.videoplayer;com.bodybuilding.mobile;com.sec.android.app.videoplayer	Open bodybuilding.com app. Show me today's workout. Show me the video for squats. Ok go back to today's workout and then show me the video for arm cross.	open bodybuilding.com app (0.94659382) show me today's workout (0.96937609) show me the video for squats (0.98498368) can I go back to today's workout and then show me the video for arm curls (0.9023543)
1508	com.android.mms;com.itgc.dreammoods.ui;com.android.mms	Open text from Leslie. Ok open dreammoods app and look up and type in ex boyfriend. Send explanation to Leslie in text.	open text from Leslie (0.85318518) open dream moods app and look up and type in ex boyfriend (0.93807983) send explanation to Leslie in text (0.95245832)
1509	com.android.mms;com.itgc.dreammoods.ui;com.android.mms	Open message. Ok open dreammoods and type in ex boyfriend and search. Send the result to Leslie in text.	open message (0.99381453) okay open dream moods and type in ex boyfriend in the search (0.8582992) send the results to Leslie in text (0.96149492)
1510	com.bodybuilding.mobile;com.sec.android.app.videoplayer;com.bodybuilding.mobile;com.sec.android.app.videoplayer;com.bodybuilding.mobile;com.sec.android.app.videoplayer;com.bodybuilding.mobile;com.sec.android.app.videoplayer	Open bodybuilding app. Show me today's workout. Ok show me the video for crunches. Ok go back to today's workout and show me the video for curls. Ok go back to today's workout and show me the video for squats. Go back to today's workout and show me the video for chest press.	open bodybuilding app (0.98170608) show me today's workout (0.9691748) okay okay um show me the video for crunches (0.96276879) okay go back to today's workout and show me the video for curls (0.93325031) how can I go back to the web today at today's workout and show me the video for squats go back to today's workout and show me the video for chest press
1511	com.sec.android.gallery3d;com.sec.android.mimage.photoretouching	Take photo. edit photo. Crop to smaller size. Four by six.	take photo (0.98762906) edit photo (0.83452356) crop to smaller size (0.97394532) 4 Essex (0.9363308)
1512	com.amazon.mShop.android;com.amazon.kindle	Open Amazon and search for Gone Girl. select the kindle copy and buy. Send the copy to Android phone. Open Kindle app. Download Gone Girl.	open Amazon and search for gone girl (0.98721462) i select the Kindle Fire be in by send the copy to Android phone open Kindle app download gone girl (0.97238213)
1513	com.google.android.gm;com.android.chrome;com.android.vending	Open Gmail. Ok follow the link. Now go to the play store and search for research data app. Download app to phone. Open on complete.	open gmail (0.97870129) okay follow link (0.83946085) now go to the Play Store and search for research data app (0.94525534) download app to phone (0.9526422) open on complete (0.96431166)
1514	com.android.chrome;com.google.android.youtube;com.facebook.katana	Watching youtube kitty video on facebook and repost to Sally's page facebook.	
1515	com.lge.email;com.facebook.orca;com.facebook.katana	Go into my email looking for contact information for Uberzone dot com for Suzy post it on facebook.	
1516	com.lge.camera;com.facebook.katana	Camera take photo and post to my facebook account	
1517	com.lge.camera;com.facebook.katana	View photo gallery pull up photo Keep Calm and Watch the Chiefs lose. Post on facebook page.	 
1518	com.android.mms	Send Stealer photo message to Marci Cellphone.	send Steeler photo message to Marcie cell phone
1519	com.google.android.youtube;com.facebook.katana	Youtube videos happy birthday mice playing piano post to Sally's facebook page.	YouTube YouTube videos happy birthday mice playing piano post to Sally's Facebook page (0.96601862)
1520	com.google.android.youtube;com.facebook.katana	Go to youtube happy birthday playlist select happy birthday mice playing piano and share to sallys facebook page.	go to youtube happy birthday playlist select happy birthday mice playing piano and post and share to Sally's Facebook page done (0.92923355)
1521	com.facebook.katana;com.android.mms	Posting on youtube i'm sorry posting on facebook Bill Peduto was on undercover boss. Sending text message to Suzy Melissa and Sally about Bill Peduto on tv.	posting on YouTube sorry posting on Facebook the picture that was on Undercover Boss sending text messages to Susie Melissa and Sally about the Perdido on TV done
1522	com.google.android.youtube;com.facebook.katana	Go to youtube happy birthday playlists select happy birthday mice playing piano and share on Rus Connelly's facebook timeline.	go to youtube happy birthday playlist select happy birthday mice playing piano and share on Russ Conway Facebook Timeline (0.91669285)
1523	com.android.gallery3d;com.facebook.katana	Photo gallery view photo gallery select photo of freezing man waiting for port authority bus post it to my timeline.	photo gallery view photo gallery select photo of freezing man waiting for Port Authority bus posted to my timeline
1524	com.android.browser;com.facebook.katana	Google Tv listings pittsburgh. Post Sirens photo on facebook page.	Google TV listings Pittsburgh (0.95847535) post sirens photo on Facebook page (0.92771703)
1525	com.android.browser;com.android.calendar	Ok. Google Tv listings pittsburgh. Go into AOL tv listings. What time is Sirens on USA channel? Post to Calendar.	okay Google TV listings Pittsburgh (0.98236114) okay go into AOL TV listings (0.93072623) what time is sirens on USA channel (0.98652071) post to calendar (0.97047377)
1526	com.android.chrome;com.facebook.katana	Checking Chicago Fire air times on tv listings. Post Taylor Kinney photo to facebook timeline.	checking Chicago Fire air times on TV listings (0.98249483) post Taylor Kinney photo shoot on Facebook Timeline (0.95543039)
1527	com.spotify.music	Spotify go to favorites playlist. Spotify switch to David Cassidy playlist.	Spotify go to favorites playlist (0.98428553) Spotify switch to David Cassidy playlist (0.9734385)
1528	com.android.browser;call	311 Pittsburgh city services. Outgoing call 311.	311 Pittsburgh city services outgoing call 311 (0.96346468)
1529	com.lge.camera;com.facebook.katana	Camera taking photo. Gallery post fireman poster photo onto my facebook page.	camera taking photo (0.98175621) Gallery post fireman poster photo onto my facebook page
1530	com.spotify.music;com.android.contacts;com.android.mms	Spotify pull up favorite diamond rio one more day. Contacts look up Melissa cellphone. Send link to the song.	Spotify pull up favorites Diamond Rio one more day (0.99111283) contacts look up Melissa cell phone (0.96483916) send link to song (0.98275781)
1531	com.lge.email;com.buytopia.snap;com.facebook.katana	Check emails. Ok open link to Buytopia. Post link to facebook link to buytopia shopping.	check emails (0.98034179) okay open link to buy topia (0.85484487) post link to Facebook and then link link to buy Tobias shopping
1532	com.facebook.katana;com.pinterest;com.facebook.katana	going to my facebook page. check message. Follow link. Post to facebook.	I'm going to Facebook my facebook page (0.9186874) check message (0.57078183) solo wank post to Facebook (0.97769767)
1533	com.lge.email;com.android.calendar	Ok check email messages from Ming. Ok create new message I'm sorry create new email. " Email to Ming ""updated schedule for meeting""." Ok post new meeting date to calendar.	ok check email messages from men okay um create new message via the upstart create new email email to main updated schedule for meeting ak post to cat post new meeting date to calendar
