1194	com.android.mms	Group text Krista and Kelly at home. I'm on my way.	I'm group text Krista and Kelly at home I'm on my way (0.97936589)
1195	com.android.vending;com.hulu.plus	Download a Hulu app from the Play Store. Open Hulu play first episode of the One Hundred.	download Hulu app from the Play Store open Hulu play the first episode of the 100 (0.98636216)
1196	com.sec.android.app.camera;com.android.mms	Open camera. Take picture. Text picture to Krista. No text.	open camera (0.98762906) take picture (0.9510603) text picture to Krista (0.88242805) no text (0.85704005)
1197	com.sec.android.app.camera;com.android.mms	Open camera. Take picture. Text picture to Krista with no text.	open camera (0.98762906) take picture (0.97692335) text picture of a crystal with no text (0.89206588)
1198	com.sec.android.app.camera;com.android.mms	Open camera. Take picture. " Text picture to Krista with a text ""this is the error""."	open camera (0.98762906) take picture (0.98634398) I'm text picture to Crystal with a text this is the air
1199	com.sec.android.app.camera;com.android.mms	Open camera. Take picture. Text the picture to Krista without text.	open camera (0.98762906) take picture (0.99458182) I'm text to picture to Crystal without text
1200	com.android.mms;com.sec.android.app.camera;com.android.mms;com.instagram.android	Read message. Open camera. Take picture. Text the picture to Krista with no text. Upload picture to Instagram. No text. Open picture in Instagram. close instagram	read message (0.98688877) open camera (0.98762906) take picture (0.93676162) text a picture to Crystal with no text upload picture to Instagram (0.92961639) no text open picture in Instagram (0.97687811) close Instagram (0.93855309)
1201	com.android.contacts;com.snrblabs.grooveip	Open contacts. View received calls. close phone. Open grooveip. View received calls. call second received call.	open contacts (0.98762906) view received calls Klos phone open groove IP (0.98762912) view received calls call second receive call (0.85376906)
1202	com.android.mms;com.sec.android.app.camera;com.android.mms	Read text. Open camera. Take picture. Text Krista picture with a text 1991.	free text open camera (0.98762906) take picture (0.9801724) text Krista picture with a text 1991 (0.94789827)
1203	com.skype.raider;call	Call home using skype.	um call home using Skype (0.86414874)
1204	com.android.vending	update apps on Google play.	update apps on Google Play (0.98540479)
1205	com.google.android.gm;com.android.browser;com.android.calendar;cmu.troy.androidlogger	Open Gmail. Read message. Click Click the link to the doodle pool. put me down for Thursday at 4 o'clock. Add that reminder to my calendar. open the open the log. Send the recent logs to L A C S.	open gmail (0.9787271) read message (0.98762906) click click the link to the doodle poll (0.97890651) put me down for Thursday at 4 o'clock (0.97827899) add a reminder to my calendar (0.9736281) open up the open log send all recent logs lacs (0.94977933)
1206	com.android.vending;com.android.settings	update Google Play apps. Clear cache from Facebook.	update Google Play apps (0.98762906) clear cache from Facebook (0.94421762)
1207	com.google.android.gm;com.android.browser;com.android.calendar	check my email. Read the read new messages. schedule me for Thursday at four o'clock. Set a reminder in my calendar and	check my email (0.99175268) read the read new messages (0.97418243) schedule me for Thursday at 4 o'clock set a reminder in my calendar and a
1208	com.android.mms;com.android.contacts	send a text message to 1231234567. Hey want to catch that movie on Saturday? Add 1231234567 to contacts. Mariana.	um send a text message to 123 1234567 hey want to catch that movie on Saturday add123 1234567 to contacts (0.84727675) Mariana (0.82003337)
1209	com.android.vending;com.sega.sonicjumpfever;com.igg.castleclash	Update apps on Google Play. Open Sonic Jump Fever. Close Sonic Jump Fever. Open Castle Clash. Close Castle Clash.	update apps on Google Play (0.98131639) open sonic jump fever (0.98762906) closest sonic jump fever (0.98762906) open castle clash (0.98762912) close castle clash
1210	com.android.calendar;com.android.mms	Check my schedule for Thursday. Text Marla that I am free on Thursday for anything.	check my schedule for Thursday (0.98762906) text Marla that I'm free on Thursday for anything
1211	com.android.calendar;com.android.mms	If I am free on Thursday text Marla that I am free.	if I'm free on Thursday text Marlo that I'm free (0.94077855)
1212	com.android.vending;com.android.settings;com.android.vending	update apps on Google Play. clear ... clear the cache and retry updating the apps.	update apps on Google Play (0.98539102) clear clear the cache and retry updating the apps
1213	com.android.vending;com.android.settings	Update apps on Google Play. Clear cache for all my apps.	update apps on Google Play (0.98621893) clear cache route for all my apps
1214	com.google.android.gm;com.android.browser;com.android.calendar	Open my open Gmail. Is it from L A C S? Schedule me for Thursday at 4. Remind me that remind me of that event on Thursday.	open my open gmail (0.95078635) is it from lacs (0.97236246) schedule me for Thursday at 4 (0.96764916) remind me that all remind me of the events on Thursday
1215	com.android.vending;com.android.settings	Update apps on Google play. Clear Cache.	update apps on Google Play (0.98622102) clear cache
1216	com.google.android.gm;com.android.browser	Check my Gmail. Is it from L A C S? follow the link to to the doodle and respond for 2:30 on Wednesday.	check my gmail (0.97140712) is it from lacs (0.97247267) umm follow the link to the doodle poll and respond for 2:30 on Wednesday (0.90584075)
1217	com.android.vending;com.android.settings	Update apps on google play and clear cache.	update apps on Google Play and clear cache (0.9865799)
1218	com.google.android.gm;com.android.browser	Check Gmail. Open up the email. Open up the link.	check Gmail (0.9801029) open up the email (0.96760494) open up the link (0.94087034)
1219	com.android.vending;com.android.settings;com.facebook.katana	Update Facebook on Google Play. Clear the cache and open up facebook.	update facebook on Google Play (0.98421592) clear the cache and open up Facebook (0.97557127)
1220	com.google.android.gm;com.android.browser;com.android.calendar;cmu.troy.androidlogger	Open Gmail. Who's it from? Follow the link to the doodle poll and give me the options. Put me down for Thursday at five pm. Set a reminder on my calender and send logs for all previous dates up until yesterday.	open gmail (0.98556018) who's a from (0.79520798) follow the link to the doodle poll and give me the options (0.9627378) put me down for Thursday at 5 p.m. set me set a reminder on my calendar and send logs for all previous dates up until yesterday
1221	com.android.vending;com.android.settings	Update apps on google play and clear cache.	update apps on Google Play and clear cache (0.9865762)
1222	com.google.android.gm;com.android.browser;com.android.calendar	Open up gmail. Is it from LACS? follow the link to the doodle poll and give me the options for dates. put me down for thursday at five pm and set a reminder on my calender.	open up Gmail (0.98413712) is it from lacs (0.96232718) follow the link to the doodle poll and give me the options for dates (0.96542376) put me down for Thursday at 5 p.m. and set a reminder on my calendar (0.98249167)
1223	com.android.mms	open up message. Text reply sorry I can't and add number to contacts.	open up message (0.97861177) text reply sorry I can't and add number to contacts (0.96517265)
1224	com.android.vending;com.sega.sonicjumpfever;com.igg.castleclash	Update sonic jump fever and castle clash. Open sonic jump fever. Close sonic jump fever and open up castle clash.	update sonic jump fever on Castle clash open sonic jump fever (0.98762906) closest sonic jump fever and open up Castle clash
1225	com.android.calendar;com.android.mms	What hours am I free on for saturday? text Marla that I am free from one to five.	what hours am I free on for Saturday (0.92588735) text my love that I am free from 1 to 5
1226	com.android.vending;com.android.settings;com.android.vending	Update apps on googleplay. clear cache and try updating again.	update apps on Google Play (0.9862231) clear cache and try updating again (0.98299915)
1227	com.android.mms;com.skype.raider	Open up text messages. Open up message. Call Vocelli pizza using skype.	open up text messages (0.98762906) open up message (0.94589525) call Vocelli pizza using Skype (0.9841677)
1228	com.google.android.gm;com.android.browser;com.android.calendar	Open up gmail. Whose it from? open the link in the email and give me the different dates available. Put me down for thursday at five pm and set a reminder on my calendar.	open up Gmail (0.98859185) who is it from (0.88677347) um open the link in the email and give me the different dates available (0.97207373) put me down for Thursday at 5 p.m. and set a reminder on my calendar (0.98157668)
1229	com.google.android.gm;com.android.browser;com.android.calendar	Open up gmail. tell me who the message is from. Follow the link and give me options for the next date. Put me down for thursday at five pm and add that to my calendar.	open up Gmail (0.9836573) tell me who the message is from follow the link and give me options for the next date put me down for Thursday at 5 p.m. and add that to my calendar (0.97404408)
1230	com.android.settings;com.android.browser	Connect to Amtrak wifi and open it. Open up to yahoo to check that it works.	connect to Amtrak Wi-Fi and open up in open up to Yahoo to check that it works
1231	com.android.settings;com.android.browser	connect amtrak wifi and open up yahoo.	connect to Amtrak Wifi and open up yahoo
1232	com.android.settings;com.android.vending	clear cache and update all apps on googleplay.	um clear cache and update all apps on Google Play (0.96647704)
1233	com.android.settings;com.android.vending	Clear cache and update all apps on googleplay.	clear cache and update all apps on Google Play (0.96912545)
1234	com.android.settings;com.android.vending	Clear cache and update all apps on googleplay.	clear cache on update all apps on Google Play
1235	com.android.settings;com.facebook.katana	clear all facebook data and open up facebook.	home clear all Facebook data and open up Facebook (0.97889233)
1236	com.google.android.gm;com.android.browser;com.android.calendar	Check gmail. is it from LACS? follow the link to the doodle poll and tell me the options for scheduling a date. put me down five pm on thursday and set a reminder on my calendar.	check Gmail (0.9844507) I is it from lacs (0.9311102) um followed the link to the to the doodle poll and tell me the options for scheduling and date put me down for 5 p.m. on Thursday and set a reminder on my calendar (0.98422635)
1237	com.google.android.gm;com.android.browser;com.android.calendar	Check Gmail. Is it from LACS? Open the open the doodle poll. put me down for thursday at five pm and set a reminder on my calendar.	check Gmail (0.9786073) is it from alics open the app open the doodle poll (0.95177668) put me down for Thursday at 5 p.m. and set a reminder on my calendar (0.97299528)
1238	com.google.android.deskclock;com.facebook.katana	Deactivate deskclock and open facebook. Read them to me in order please. reply Good Morning sweety hope your day is going well and send.	deactivate desk clock in open facebook (0.89761549) I read them to me in order please reply good morning sweetie hope your day is going well and sent (0.92750335)
1239	com.google.android.apps.maps;com.android.mms;com.android.chrome	look up estimated time remaining to Rochester Station. Ok please send a text message to Joelle informing her I will be arriving at that time. Alright while were waiting go ahead and open up chrome and lets browse 9gag for the rest of the time.	um look up estimated time remaining to Rochester station (0.94411731) um okay please send a text message to Joelle informing her I'll be arriving at that time write up while waiting go ahead and open up Chrome and let's browse 9gag for the rest of the time
1240	com.google.android.gm;com.android.mms;com.android.chrome	can you read me any new emails I've recieved? What does he want to know? let him know I'll be there in about half an hour. just go ahead and reply by email. Ok it looks like I have a new text message coming in can you read that to me? Tell her I already told her I'd be there in 30 minutes. And continue browse where we left off in chrome.	can you read me any new emails I received (0.96338356) Oh what you want to know (0.87317055) let him know I'll be there in about a half hour (0.92949045) a good reply by email (0.93244344) all right looks like I have a new text message coming in can you read that to me (0.93268138) autoality told her I'd be there in 30 minutes (0.85853976) and continue browsing where we left off in Chrome
1241	com.google.android.gm;com.google.android.apps.maps;com.android.chrome	Can you tell me if i've recieved any more emails? And whats he want to know? Alright excellent any more emails? Alright are we get how much further till we arrive at rochester station? go ahead and continue browsing chrome were we left off.	um can you tell me if I received any more emails (0.97435576) do what you want to do excellent any more emails (0.94929743) how much further until we arrive at Rochester station (0.96509767) go ahead continue browsing from where we left off
1242	com.facebook.katana;com.google.android.gm;com.android.chrome	Can you check for any new facebook stories in my newsfeed? Go ahead and like his post. Any new emails? Go ahead read it. tell him im actually busy tonight I have plans with the family. And go ahead and continue browsing chrome.	I can you check for a new Facebook stories in my newsfeed go ahead like his post (0.84142315) anime males 200 it (0.65511203) autoland actually busier than I have had plans for the family and go ahead and continue browsing Chrome (0.96518248)
1243	call	Ok go ahead and call Mom on her mobile please. Alright let's go ahead and try dad on his mobile then.	a gun call mom on her mobile please alright let's go h***** dad on his mobile (0.95747161)
1244	com.facebook.katana;com.google.android.gm;com.android.chrome	can you check for any new facebook stories please? Alright any new emails? Alright what does he have to say? " Alright just go ahead and reply and tell him ""That sounds good""." And just open up chrome and continue where we left off.	can you check for any new Facebook stories please (0.93405122) write a new email (0.43989301) what you have to say it's goin reply and tell him that sounds good Andres open Chrome and continue where we left off (0.82933146)
1245	com.android.chrome;com.motorola.MotGallery2;com.facebook.katana	computer use google image search to locate an image of Homer Simpson being bored. Ok can you show them to me. Alright I like the first one go ahead and send it to Joelle on facebook.	um computer use Google image search to locate an image of Homer Simpson being bored (0.90911049) okay can you show them to me (0.987629) I like the first one go ahead and send it to do well on Facebook (0.85926527)
1246	com.facebook.katana;com.android.chrome	computer are there any additional facebook messages or stories that have come in? Alright let's just continue browsing chrome then.	um computer are there any additional Facebook messages or stories that have come in (0.93606651) alright let's just continue browsing chrome then
1247	com.google.android.gm;com.android.calendar;com.google.android.gm	Read it to me please. can you open up the calendar and check my availability for this week? Alright go and please let them know that.	original please (0.80019563) can you open up calendar and check my availability for this week (0.98030657) but please go and let them know that (0.91270113)
1248	com.android.chrome;com.google.android.youtube	can you open chrome and google how to reset the oil on a twenty ten Honda Civic? Alright it looks like the first result is a youtube video go ahead and play that for me.	um can you open Chrome and Google how to reset the oil on a 2010 Honda Civic (0.97379464) looks like the first result is a YouTube video go and play that for me
1249	com.google.android.apps.maps;call	open up maps and pull up the info page for Pittsburgh Elementary School. Is there a phone number listed? Go ahead and call it please.	open up maps and pull up the info page for Pittsburg elementary school (0.90326661) the phone number listed (0.89949691) go and Colour please (0.64349151)
1250	com.android.chrome;com.google.android.apps.maps;call	can you google the telephone number for Belleview Christian Church? Go ahead and show me the first one. Alright go ahead and open up google maps please. And open up the maps page for Belleview Christian Church at my current location. Ok call it please.	can you google the telephone number for Bellevue Christian Church (0.94666147) figures from the first one Lego head open up Google Maps please and open up the maps page for Bellevue Christian Church at my current location call please (0.62515795)
1251	call;com.android.mms	can you please call Peter on their mobile phone? Now in the real thing no one picked up. Alright go ahead and text them that we're going to be closed today due to the weather. Alright just to be sure lets call them at home.	um can you please call Peter on their mobile phone (0.96328479) no the real thing no one picked up so (0.86771321) I go ahead and text them not working to be closed today due to the weather please (0.86194569) alright I just miss Shirley's cohan call them at home to make sure they get the message (0.86469114)
1252	com.android.chrome;call	can you look up the phone numbers for the school and make a phone call there please?	can you look up the phone numbers for the school and I make a phone call there please
1253	com.motorola.camera;com.motorola.MotGallery2	open camera and take picture please. Can you open it in the gallery?	open camera and take a picture please (0.97665197) can you open up my gallery
1254	com.google.android.apps.maps;com.android.chrome	open google maps please and find the nearest train station. and then can you look up the departures from that station?	open Google Maps please in find the nearest train station (0.96370429) and then can you look up the departures from the station (0.96194464)
1255	call;com.android.mms	call mom please on mobile. hang up. Please text mom that we are about half way there.	um call mom please on mobile (0.94523072) hang up (0.80986083) please text mom that we are about halfway there (0.97905159)
1256	com.google.android.gm;com.facebook.katana;com.google.android.gm;com.facebook.katana;com.google.android.gm;com.facebook.katana	please check gmail and facebook for any new messages. Please read them to me. Go ahead and delete the email and open up the facebook article.	please check Gmail and Facebook for any new messages please return to me (0.76556313) go ahead and delete the email and open up the Facebook article
1257	com.android.mms;call	please check for any new text messages. can you read it to me please? Alright go ahead and call him back. mobile.	please check for any new text messages (0.95441818) I can you read it to me please (0.96804142) I go and come back (0.90935278) Mobile (0.84043086)
1258	com.google.android.gm;com.android.calendar;com.google.android.gm	Umm please check for new emails. Can you read it to me please? what time? Ok go ahead and add that to my calendar. Let him know I'll be there.	um I please check for new emails (0.88473958) can you read it to me please (0.98198658) at what time (0.98320323) okay I'm going on a date to my calendar 11 a.m.
1259	com.motorola.camera;com.motorola.MotGallery2	open camera please. Please take a picture of what I am looking at. Go ahead and open up the gallery. We'll need to crop it. four by six.	open camera please (0.94133669) please take a picture of what I'm looking at (0.98762906) ok Google now open up the gallery will need to crop it (0.8469677) a 4 by 6 (0.88212842)
1260	com.facebook.katana;com.google.android.gm;com.facebook.katana	can you tell me if I have a new facebook information or any new emails? Can you read it to me please. Can you reply and tell him i'll be there.	I can you tell me if I have a new Facebook information or any new emails (0.94190681) rate me please can reply and tell him I'll be there (0.95025676)
1261	com.android.mms;call	check for new text messages please. Alright what's she have to say. Alright go ahead and call her back please. Mobile.	check for new text messages please (0.98546624) what you have to say (0.96672362) I got a call back please (0.90827221) Mobile (0.89157677)
1262	com.android.chrome;com.google.android.apps.docs	Open google docs please. access work folder. And open the most recent document I have in there please.	um open Google Docs please (0.87053126) access work folder (0.96009606) end up in the most recent document I have in there pussys
1263	com.motorola.camera;com.motorola.MotGallery2;com.android.mms	take picture please. " And send to Sean via MMS to his cellphone with the caption ""lolz""."	take picture please (0.97482485) and as sin to shun via MMS to his cell phone with the caption lol
1264	com.motorola.camera;com.android.mms	take a picture of what I'm looking at and send it to Joelle please. say I thought you would laugh when you see this.	take a picture while looking at it and send it to draw fleas say I thought you would laugh when you see this (0.97359705)
1265	com.android.mms;call	Can you read it to me please? Call her back so I can tell her I see her all the time please. On Mobile.	Kirito please (0.85430729) um quarterback so I can tell her I see her all the time please (0.93783712) automovil
1266	com.facebook.orca;com.motorola.MotGallery2;com.facebook.katana	do I have any new messages from my friends? Alright what's he have to say? Ok go into my memes folder and send him the latest funny cat picture. Alright while were there go ahead and post that to facebook.	do I have any new messages from my friends (0.98572987) what you have to say okay I'm going to make memes folder and sent him the latest funny cat picture RIAM whatever they are going and post that to Facebook
1267	com.etermax.preguntados.lite;com.facebook.katana	Alright open trivia crack please. tell me the results of my game with Sara. Ok post on facebook and say shes a filthy liar.	alright I am open trivia crack please (0.80162078) tell me the results of my game with Sarah (0.9306345) ok post on Facebook that say she's a filthy liar
1268	com.pnc.ecommerce.mobile;com.android.chrome	open PNC mobile please. Ok I need to remote deposit this check. Alright and then just bring up my balance to make sure it actually went in. How much do I have in there?	open PNC mobile please (0.98004675) okay um I need to remote deposit this check right arm and then just bring up my balance to make sure taxi 1 in (0.83599341) how much do I have in there (0.97321051)
1269	com.facebook.katana;com.etermax.preguntados.lite	please find any friends available to play trivia crack. Alright challlenge her and tell her that i'm going to kick her butt this time.	please find any friends available to play trivia crack (0.96406341) challenger and tell her that I'm gonna kick your butt this time
1270	com.android.chrome;com.android.calendar	can you google pittburgh theater and find when the play Gypsy is going to be in town? Alright do they have any friday availabilities? Alright will you put a note in my google calendar reminding me to get tickets for that date and time?	can you google Pittsburgh theater and find when the play gypsies going to be in town do they have any Friday (0.97203171) we put a note in my Google Calendar remind me to get tickets for that date and time
1271	com.facebook.katana;com.etermax.preguntados.lite;com.facebook.katana	can you check facebook for anyone using trivia crack? Alright go ahead and challenge her and while you're at it let me know if I have any new posts. Ok what's it say?	hey can you check facebook for anyone using trivia crack (0.9526006) challenge her and I wire it let me know if I have a new posts (0.84762883) okay what to say (0.85665202)
1272	com.motorola.camera;com.motorola.MotGallery2	can you take a picture of what I'm look at please. And then crop it to four by six remove about twenty percent of the periphery. Ok show me what does that look like? That looks good.	can you take a picture of what I'm looking at please and then I crop a 24 bisex remove about 20% of the periphery (0.86469376) elke Sommer that looks like it looks good (0.72419024)
1273	com.jawbone.up;com.google.android.gm;com.facebook.katana	can you tell me how many calories I burned on this here walk? haha go ahead and while were at can you tell me if I have any new emails or facebook? Open please. Go ahead and delete that.	um can you tell me how many calories are burned on this year walk (0.96542484) go ahead and I will read it can you tell me if I have any new emails or Facebooks open please (0.95590031) delete that (0.95945275)
1274	com.motorola.MotGallery2;com.android.mms	please send the most recent picture to Joelle on her cellphone. Oh boy can you generate an inappropriate joke for me to go with this picture?	umm please send the most recent picture to do well on her cell phone (0.85922176) boy can you generate an inappropriate joke for me to go with this picture (0.9464879)
